job_name,company_name,city,salary,jd_text
前端开发,安徽布袋王环保科技有限公司,安庆,8000.0,3年及以上 本科 erp 前端开发 echarts 库存管理 vuex webpack 仓库管理 入库 vue.js wms 方案 五险 带薪年假 年终奖金 绩效奖金 项目奖金 专业培训 出国机会 定期体检 包住 包吃
前端开发,石家庄鸣迅信息技术有限公司,武汉,12000.0,无需经验 本科 五险一金 年终奖金 做五休二 定期体检 绩效奖金 专业培训 餐饮补贴 双休 带薪年假 交通补贴 通讯补贴 周末双休 节日福利 弹性工作 节假日福利
前端开发,南京睿帆信息科技有限责任公司,南京,8000.0,3年及以上 大专 测试 git 前端开发 web 软件工程 elementui 前端框架 交互设计 node.js 软件系统 五险一金 带薪年假 带薪病假 绩效奖金 项目奖金
android,深圳市同昌汇能科技发展有限公司,广州,15000.0,2年及以上 本科 c++ 驱动开发 技术支持 Linux Android Makefile编程 Shell编程 linux内核 系统设计 产品专利 五险一金 年终奖金 绩效奖金
前端开发,广东绿力网络技术有限公司,广州,12000.0,5年及以上 本科 计算机 java jquery javascript 需求分析 vue 开发 ajax 前端 html5 双休 五险一金 餐饮补贴 通讯补贴 专业培训 年终奖金 弹性工作 员工旅游 定期体检
前端开发,广州碧软信息科技有限公司,广州,11000.0,3年及以上 本科 javascript vue 开发 前端 html5 前端开发 react webpack es6 前端框架 五险一金 补充医疗保险 员工旅游 绩效奖金 年终奖金 定期体检
android,上海移远通信技术股份有限公司,佛山,15000.0,3年及以上 本科 java c++ android 高通平台 framework 车载行业 系统应用 五险一金 定期体检 餐饮补贴 专业培训 员工旅游 交通补贴 周末双休 方案
android,睿云联（厦门）网络通讯技术有限公司,厦门,12000.0,2年及以上 本科 ios flutter 移动端 app开发 软件工程 智能家居 绩效奖金 年终奖金 五险一金 补充医疗保险 员工旅游 股票期权 通讯补贴 交通补贴 弹性工作 定期体检
android,深圳市霍博克电子科技有限公司,深圳,15000.0,5年及以上 本科 app设计 c++ 客户端开发 技术支持 开源架构 android spring mysql mybatis java 五险一金 员工旅游 周末双休 不加班
前端开发,广州巨有科技有限公司,广州,7000.0,3年及以上 大专 测试 css html javascript 需求分析 开发 ajax 前端 前端开发 性能测试 方案 专业培训 绩效奖金 年终奖金 每周下午茶 五险 组织看电影 交通补贴 带薪年假 做五休二 节假日福利
前端开发,菲亚兰德科技,深圳,15000.0,3-5年 本科 Shopify开发 c端网站开发 独立站开发 五险一金 员工旅游 股票期权 交通补贴 专业培训 餐饮补贴 年终奖金 绩效奖金 定期体检 零食下午茶
前端开发,南京轨道交通系统工程有限公司,南京,8500.0,无需经验 硕士 jquery css html javascript vue 前端 前端框架 bug修复 后端开发 浏览器 五险一金 定期体检 做五休二 专业培训 餐饮补贴 双休 带薪年假 交通补贴 补充医疗保险 通讯补贴 高温假 节假日福利
android,深圳市海普天智能科技有限公司,深圳,15000.0,3-4年 大专 mqtt http androidui androidndk androidsdk Kotlin 人脸识别 支付 RK3568 消费 五险 通讯补贴 专业培训 绩效奖金 年终奖金 全勤奖 工龄奖 带薪年假 法定假期
ios,前锦网络信息技术（上海）有限公司,广州,25000.0,5年及以上 本科 单元测试 技术架构 swift ios开发 objective_c app开发 技术支持服务 ios 五险一金 年终奖金 餐饮补贴 周末双休 交通补贴 补充医疗保险
前端开发,深圳市俊晴科技有限公司,郴州,8000.0,2年及以上 大专 css html javascript git react http web开发 nodejs node.js 前端 五险一金 年终奖金 公积金 专业培训 法定节假日
android,深圳市沃特沃德股份有限公司,深圳,15000.0,5年及以上 本科 计算机 java 需求分析 调试 数据结构 app 设计模式 android 功能开发 性能调优 方案 五险一金 带薪年假 带薪病假 年终奖金 定期体检
前端开发,广州汇思信息科技股份有限公司,合肥,7000.0,3年及以上 本科 计算机 jquery css javascript vue 前端 html5 js 编码 xml 周末双休 专业培训 五险一金 绩效奖金 弹性工作
前端开发,安阳呈泰信息技术服务有限公司,北京,10000.0,1年及以上 大专 git 编程 前端开发 代码编写 单元测试 docker ai 技术文档 机器学习 计算机科学 方案 五险一金 带薪年假 员工旅游 年终奖金 绩效奖金 定期体检 定期团建 零食下午茶 项目奖金 补充医疗保险
android,深圳市绿联科技股份有限公司,深圳,25000.0,5年及以上 本科 计算机 java 编程 mvc 网络 数据结构 设计模式 android ai h5 下午茶 技能培训 房补 年终奖 公司福利 团建 聚餐 年度旅游 导师制 六险一金 年度体检 提供食宿 晋升 方案 生日会
前端开发,见鲸科技（南京）有限公司,南京,12000.0,3年及以上 本科 计算机 css html javascript vue 开发 前端 html5 js app 兼职 坐班 零食下午茶 五险一金 年终奖金 项目奖金 节日福利 生日福利
android,深圳鹏智瑞数字营销有限公司,深圳,12000.0,5年及以上 大专 计算机 java 需求分析 开发 功能测试 性能测试 android 架构设计 技术文档 兼容性测试 五险一金 专业培训 定期体检 年终奖金 带薪年假 年节福利 周末双休 生日会下午茶 团建旅游 加班打车
前端开发,深圳市武测空间信息有限公司,深圳,10000.0,3年及以上 本科 javascript html5 前端开发 软件工程 echarts react webpack gis vue.js bug修复 五险一金 餐饮补贴 定期体检 周末双休 员工旅游 年终奖金
前端开发,上海壹杰医疗科技有限公司,上海,12000.0,3年及以上 本科 计算机 linux javascript ajax html5 js web 设计模式 es6 用户体验 五险一金 年终奖金 专业培训 餐饮补贴 带薪年假 员工旅游
android,中控技术股份有限公司,杭州,15000.0,5年及以上 本科 java 开发 js android ios 性能调优 技术文档 flutter 框架设计 swift 方案 五险一金 餐饮补贴 交通补贴 年终奖金 定期体检 弹性工作 员工旅游
android,胜通和科技有限公司,北京,15000.0,1-3年 本科 计算机 java c++ git android wms 内存管理 audio pms jni 五险一金 年终奖金 绩效奖金 定期体检 餐饮补贴 专业培训 交通补贴 周末双休 节日福利 通讯补贴 加班补贴
前端开发,上海北辰软件股份有限公司,上海,10000.0,1-3年 本科 计算机 测试 css html javascript 需求分析 vue ajax 调试 前端 五险一金 专业培训 做五休二 双休 带薪年假 周末双休 节日福利 节假日福利
android,开沃新能源汽车集团股份有限公司,南京,9000.0,3年及以上 本科 计算机 linux 需求分析 调试 c++ 数据结构 技术文档 算法 图像处理 五险一金 年终奖金 绩效奖金 定期体检 餐饮补贴 专业培训 员工旅游 周末双休 通讯补贴 免费班车
android,武汉中科岩土工程技术培训有限公司,武汉,8000.0,2年 本科 android开发 android 网络通信 sdk okhttp mvp kotlin jetpack 五险一金 餐饮补贴 绩效奖金 年终奖金 定期体检 专业培训 节日福利
android,上海荣灿信息科技有限公司,苏州,13000.0,3年及以上 本科 git 编程 bug 单元测试 ui设计 代码质量 版本控制工具 kotlin 代码习惯 代码审查 五险一金 绩效奖金 年终奖金 定期体检 专业培训 带薪年假 项目奖金
android,上海石田电子衡器有限公司,上海,12000.0,4年及以上 本科 计算机 java 项目管理 c++ 软件开发 android 软件设计 包装机 安卓开发 五险一金 定期体检 餐饮补贴 员工旅游 交通补贴 周末双休 免费班车 补充公积金
前端开发,深圳市卫飞科技有限公司,济南,8000.0,无需经验 本科 计算机 java javascript vue 开发 前端 前端开发 软件工程 app uniapp 五险一金 带薪年假 年终奖金 绩效奖金 项目奖金 带薪病假 员工旅游 出差补贴 球场 节日礼金
前端开发,上海全晓信息技术有限公司,北京,16000.0,5年及以上 本科 jquery vue ajax svn html5 git ps js mvc 前端开发 旅游 五险一金 做五休二 专业培训 餐饮补贴 带薪年假 交通补贴 周末双休 方案 节假日福利 住房补贴
前端开发,东莞立讯技术有限公司,东莞,16000.0,3年及以上 本科 jquery css html javascript vue 前端 前端开发 react webpack es6 五险一金 年终奖金 带薪年假 带薪病假 专业培训 出国机会 包吃 有餐补
ios,广东艾罗照明科技股份有限公司,广州,13000.0,3-5年 本科 计算机 调试 编程 文档编写 项目开发 单元测试 编码 tcp ios 网络协议 五险一金 绩效奖金 健身房 带薪年假 带薪病假 全勤奖 员工福利 导师制 晋升 购买五险 培训 年度体检 方案 管理培训 免费午餐
android,一起生活网络成都有限公司,成都,8000.0,1年及以上 大专 socket api http协议 蓝牙 sdk 串口 安卓开发 nfc 支付 人脸设备 五险一金 周末双休 节日福利 带薪年假 工龄工资 免费午餐 五险
ios,深圳市绿联科技股份有限公司,深圳,25000.0,5年及以上 本科 计算机 软件开发 ai ios 产品研发 图像处理 swift camera ios开发 人才引进 下午茶 技能培训 房补 年终奖 公司福利 团建 聚餐 年度旅游 导师制 六险一金 年度体检 提供食宿 晋升 方案 生日会
android,茂佳科技（广东）有限公司,惠州,15000.0,3年及以上 本科 计算机软件 framework android os 六险一金 带薪年假 年终奖金 项目奖金 专业培训 出国机会 定期体检 有餐补 通讯补贴 定期团建
android,中国—东盟信息港股份有限公司,南宁,10000.0,3年及以上 本科 sdk java linux html5 js 功能设计 方案设计 架构设计 功能开发 方案 五险一金 带薪年假 年终奖金 绩效奖金 定期体检 有餐补 通讯补贴 交通补贴
ios,深圳市超越科技开发有限公司,深圳,10000.0,3年及以上 本科 编程 多线程 软件设计 数据结构算法 数据存储 swift ios开发 iOS蓝牙 ios app 年终奖金 绩效奖金 专业培训 周末双休 带薪年假 节日福利 补充医疗保险 提供住宿 五险
前端开发,中交疏浚技术装备国家工程研究中心有限公司,上海,15000.0,3年及以上 本科 GeoServer 五险一金 年终奖金 定期体检 绩效奖金 专业培训 餐饮补贴 双休 带薪年假 员工旅游 交通补贴 补充医疗保险 通讯补贴 周末双休 节假日福利
ios,益方生物科技（上海）股份有限公司,上海,22000.0,5年及以上 硕士 simulation data delivery 五险一金 带薪年假 带薪病假 员工旅游 年终奖金 股票期权 定期体检 零食下午茶 有餐补 交通补贴
android,深圳市深智电科技有限公司,深圳,15000.0,1年及以上 本科 linux android bug修改 driver rockchip amlogic 五险一金 弹性工作 绩效奖金 年终奖金 员工旅游 节日福利 项目奖金 带薪年假
前端开发,宁波赛宸进出口有限公司,宁波,面议,1年 本科 架构设计 mysql数据库 php linux 插件 网站开发 seo优化 计算机 建站 Web网站 五险一金 带薪年假 免费班车 绩效奖金 节日福利 专业培训 高温补贴 通讯补贴 年度旅游 住房补贴
android,深圳市慧为智能科技股份有限公司,深圳,13000.0,1年及以上 本科 framework层 mtk framework rk 五险一金 员工旅游 餐饮补贴 专业培训 出国机会 绩效奖金 年终奖金 股票期权 定期体检
android,武汉光庭信息技术股份有限公司,武汉,25000.0,5年及以上 本科 java git mvc 网络 软件工程 react 设计模式 docker 多线程 架构设计 方案 五险一金 免费班车 餐饮补贴 年终奖金 弹性工作 定期体检 股票期权 补充医疗保险
前端开发,湖南梦图地理信息系统有限责任公司,长沙,9000.0,1-3年 本科 java 数据库 springboot springmvc sql vue 前端开发 设计模式 mongodb 技能培训 五险一金 员工旅游 餐饮补贴 绩效奖金 周末双休 意外保险
前端开发,北京中科致远科技有限责任公司,北京,8000.0,3年及以上 大专 jquery css javascript ajax 前端 html5 前端开发 react 前端框架 div 员工旅游 专业培训 绩效奖金 年终奖金 定期体检 方案 五险一金 股票期权
android,河南恰友实业发展有限公司,郑州,6000.0,无需经验 计算机 需求分析 开发 编程 android 编码 ios 代码 网络通信 架构 五险一金 交通补贴 绩效奖金 员工旅游 餐饮补贴 年终奖金 弹性工作 定期体检 补充公积金 补充医疗保险
android,宝马诚迈信息技术有限公司,上海,15000.0,3年及以上 本科 计算机 英语 软件开发 sdk kotlin android框架 android开发 车载系统 性能优化 app开发 五险一金 年终奖金 绩效奖金 弹性工作 周末双休 节日福利 带薪年假 出国机会
android,软通动力信息技术（集团）股份有限公司,深圳,13000.0,2年及以上 本科 计算机 java android 面向对象编程 数据库开发 编程习惯 性能 多线程开发 自定义控件 方案 五险一金 带薪年假 带薪病假 专业培训 定期体检 免费班车
前端开发,上海情柏电子有限公司,苏州,10000.0,无需经验 大专 五险一金 年终奖金 做五休二 定期体检 绩效奖金 专业培训 餐饮补贴 带薪年假 员工旅游 交通补贴 周末双休 节日福利 弹性工作 方案 节假日福利
ios,云南狼途传媒有限公司,昆明,9000.0,3-5年 大专 数据库 编程 ui设计 xml json ios 技术文档编写 软件产品 xcode objective_c 餐饮补贴 节日福利 员工零食区 不定期团建 生日福利 五险
android,深圳市优克联新技术有限公司,西安,12000.0,2年及以上 本科 java 开发 调试 android 软件设计 设计开发 android开发 framework 开发框架 五险一金 弹性工作 离地铁近 专业学习机会 领导好 公司氛围好 法定节假日
前端开发,苏州银丰睿哲信息科技有限公司,苏州,12000.0,5年及以上 本科 javascript vue 前端 html5 前端开发 echarts webpack es6 element_ui 编码习惯 五险一金 专业培训 商业保险
前端开发,广州上善餐饮企业管理有限公司,广州,9000.0,1年及以上 本科 计算机 javascript 需求分析 vue html5 前端开发 web 软件工程 axure 原型设计 餐饮补贴 带薪年假 节日福利 节假日福利
前端开发,江苏鑫源融信软件科技有限公司,杭州,13000.0,2年及以上 本科 银行 信贷 五险一金 定期体检 绩效奖金 专业培训 双休 餐饮补贴 补充医疗保险 周末双休 带薪年假 交通补贴 出差补贴 定期团建 有餐补 年终奖金
前端开发,大杨集团有限责任公司,大连,15000.0,5年及以上 本科 计算机 javascript ajax 英语 需求调研 html5 前端开发 方案设计 ai 前端框架 五险一金 年终奖金 做五休二 餐饮补贴 交通补贴 周末双休 通讯补贴 方案
前端开发,安阳呈泰信息技术服务有限公司,北京,12000.0,1年及以上 大专 git 编程 前端开发 代码编写 单元测试 docker ai 技术文档 机器学习 计算机科学 方案 五险一金 带薪年假 员工旅游 年终奖金 绩效奖金 定期体检 定期团建 零食下午茶 项目奖金 补充医疗保险 六险一金
前端开发,广东新安职业技术学院,深圳,面议,无需经验 硕士 项目开发 计算机网络 计算机应用 校企合作 数字媒体 web前端框架 教学资源建设 五险一金 节日福利 绩效奖金 餐饮补贴 定期体检 年终奖金 弹性工作 专业培训 带薪寒暑假
前端开发,武汉岩迪创为信息技术有限公司,昆山,12000.0,3-5年 本科 javascript 前端开发 postman react 金融行业 vuex 前端框架 FastAPI FinTech 五险一金 双休 带薪年假 周末双休 弹性工作 节假日福利
前端开发,中通服软件科技有限公司,广州,3000.0,在校生/应届生 本科 jquery javascript 需求分析 vue ajax 调试 前端 html5 编程 echarts 弹性工作 有转正机会 餐饮补贴 方案
android,东莞市漫步者科技有限公司,东莞,14000.0,2年及以上 本科 java git 软件工程 android 多线程 技术方案 性能调优 网络通信 okhttp 兼容性 五险一金 餐饮补贴 绩效奖金 年底双薪 带薪年假 包住宿 高温补贴 方案
前端开发,广东融勤教育科技有限公司,广州,10000.0,1-3年 本科 3D Three.js 可视化 大屏 员工旅游 节日福利 年终奖金 五险 法定节假 节假日 公司福利 年假 职业发展 培训 晋升 方案 交通补贴 专业培训
android,深圳天珑无线科技有限公司,深圳,10000.0,1年及以上 大专 电子 linux git 多线程 摄影 jni 并发编程 功能预研 adb 软测 五险一金 员工旅游 定期体检 节日福利 带薪年假 餐饮补贴 包住宿
android,深圳市艾利特医疗科技有限公司,深圳,13000.0,3年及以上 大专 计算机 开发 自动化 mvc 网络 设计模式 android 数学 质量控制 mvvm 五险一金 年终奖金 专业培训 周末双休 带薪年假 补充公积金 加班补贴 包住
前端开发,深圳市同为数码科技股份有限公司,深圳,15000.0,3年及以上 本科 计算机 jquery css html javascript vue ajax html5 web 设计模式 五险一金 股票期权 专业培训 弹性工作 定期体检 年终奖金 周末双休 上市公司
ios,深圳市卓永科技有限公司,广州,15000.0,5年及以上 本科 项目开发 架构设计 功能开发 ios 系统架构 产品质量 技术分析 swift ios开发 objective_c 五险一金 带薪年假 带薪病假 员工旅游 零食下午茶 出差补贴 定期团建 有餐补 交通补贴
前端开发,东莞市启泰智能科技有限公司江西分公司,九江,8000.0,5年及以上 本科 javascript vue html5 git js 前端开发 web photoshop react ui设计 方案 五险一金 带薪年假 带薪病假 员工旅游 专业培训 定期体检 包吃 包住 定期团建 免费工作餐
android,深圳市慧为智能科技股份有限公司,武汉,12000.0,1年及以上 本科 java c++ 功能开发 bug修复 wms 开发文档 mtk framework pms 软硬件联调 五险一金 员工旅游 定期体检 餐饮补贴 专业培训 绩效奖金 年终奖金 出国机会 股票期权
android,道乾智赢商业（湖南）集团有限公司,邵阳,10000.0,3-5年 本科 计算机 java 解决方案 多线程 架构设计 sdk 代码质量 kotlin 产品迭代 内存管理 节日福利 员工旅游 绩效奖金 岗位经验 任职要求 包三餐包住 工龄奖
前端开发,贵州安盛科技技术服务有限公司,南昌,7000.0,无需经验 大专 css html javascript 前端 react 前端框架 vue.js 前端页面开发 功能实现 技术方案设计 五险一金 年终奖金 带薪年假 周末双休 方案
android,江苏省精创电气股份有限公司,徐州,10000.0,3年及以上 本科 java 需求分析 git 通信 android 自动化测试 架构设计 性能调优 股权激励 弹性工作 五险一金 方案 职位晋升 股票期权 出国机会 专业培训 绩效奖金 海外工作机会 人际关系简单 企业文化开放 奋斗者为本
前端开发,上海起迪计算机科技发展有限公司,上海,5000.0,1年 本科 jquery vue html5 js web前端开发 移动端 css3 bootstrap pc 五险一金 员工旅游 餐饮补贴 出国机会 绩效奖金 年终奖金 定期体检 节日福利 带薪年假 带薪病假 拓展福利 生日惊喜 周末双休 全勤奖 员工活动
前端开发,方正国际软件（北京）有限公司,苏州,8000.0,3年及以上 本科 计算机 css html5 react ui设计 webpack 交互设计 web前端开发 web开发 node.js 五险一金 双休 带薪年假 弹性工作
前端开发,广州美保科技有限公司,南京,15000.0,3年及以上 本科 css html javascript vue 前端开发 web react 产品设计 前端框架 ui 五险一金 带薪年假 年终奖金 绩效奖金 专业培训 定期体检 零食下午茶 有餐补 定期团建 出差补贴
前端开发,聚兴智造（深圳）科技有限公司,北京,18000.0,3年及以上 本科 javascript html5 web webpack es6 vue.js 英语读写 api npm 产品需求分析 五险一金 带薪年假 绩效奖金 专业培训 零食下午茶 包住
前端开发,三星财产保险（中国）有限公司,上海,15000.0,3年及以上 本科 计算机 javascript html5 git 前端开发 web 计算机网络 互联网 webpack 微信公众号 周末双休 节日福利 五险一金 补充医疗保险 餐饮补贴 专业培训 绩效奖金 年终奖金 定期体检
前端开发,浙江鸿程计算机系统有限公司,杭州,12000.0,3年及以上 本科 计算机 css vue 开发 html5 js 前端开发 h5 页面开发 项目维护 专业培训 员工旅游 定期体检 通讯补贴 绩效奖金 年终奖金 五险一金
android,融捷教育科技有限公司,北京,35000.0,5年及以上 本科 计算机 开发 前端开发 用户体验 设计开发 mvvm 脚手架 retrofit 技术分享 安卓 补充医疗保险 交通补贴 五险一金 餐饮补贴 通讯补贴 扁平管理 节日福利 领导好 结婚红包 生子红包 十三薪
android,安谷科技股份有限公司,上海,15000.0,3年及以上 本科 java 需求分析 调试 方案设计 软件工程 android 架构设计 人工智能 编码习惯 蓝牙 方案 五险一金 交通补贴 餐饮补贴 弹性工作 周末双休
android,上海皓空数码科技有限公司,深圳,面议,2-3年 本科 android 系统开发 linux git 开发维护 系统架构 硬件调试 sdk c++ Android驱动 五险一金 绩效奖金 周末双休 节日福利 带薪年假
android,陈默金科技（上海）有限公司,无锡,面议,2年及以上 本科 eclipse android mvvm mvp okhttp android开发 rxjava eventbus exoplayer mediaplayer 五险一金 绩效奖金
前端开发,石家庄鸣迅信息技术有限公司,南京,12000.0,无需经验 本科 五险一金 年终奖金 做五休二 定期体检 绩效奖金 专业培训 餐饮补贴 双休 带薪年假 交通补贴 通讯补贴 周末双休 节日福利 弹性工作 节假日福利
android,武汉光庭信息技术股份有限公司,武汉,15000.0,3年及以上 大专 linux c++ andriod hal native vehicle 持久化存储 android 年终奖 免费班车 五险一金 餐饮补贴 年终奖金 弹性工作 定期体检 股票期权 补充医疗保险
前端开发,江苏中农生物科技有限公司,成都,7000.0,无需经验 本科 css html javascript 前端 前端开发 web react 前端框架 vue.js 接口对接 五险一金 做五休二 年终奖金 节日福利 方案
android,杭州海康威视数字技术股份有限公司,杭州,15000.0,2年及以上 本科 计算机 c++ 网络 设计模式 代码编写 android 框架 布局 组件化开发 kotlin 方案 五险一金 免费班车 通讯补贴 餐饮补贴 交通补贴 年终奖金 定期体检 股票期权 弹性工作 专业培训
前端开发,广州澳图美德信息科技有限公司,广州,12000.0,6年及以上 本科 计算机 css html javascript 前端开发 webpack 粤语 gulp http协议 grunt 五险一金 做五休二 双休 周末双休
前端开发,上海朋禾智能科技有限公司,成都,10000.0,3年及以上 本科 计算机 javascript vue svn 前端 html5 git 前端开发 react webpack 五险一金 年终奖金 做五休二 绩效奖金 节日福利 弹性工作 方案 专业培训 定期体检 员工旅游
ios,利优科技资讯服务（深圳）有限公司,天津,30000.0,8年及以上 本科 编程 英文 ios swift 五险一金 年终奖金 绩效奖金 专业培训 弹性工作 周末双休 带薪年假 补充医疗保险 通讯补贴 免费班车 补充公积金 方案 正式位置
ios,深圳鹏智瑞数字营销有限公司,深圳,12000.0,5年及以上 大专 计算机 需求分析 开发 android 架构设计 编程语言 ios 技术文档 sdk xcode 方案 五险一金 专业培训 定期体检 年终奖金 带薪年假 年节福利 周末双休 生日会下午茶 团建旅游 加班打车
android,中电金信软件有限公司,广州,15000.0,5年及以上 本科 svn git android 安全 代码版本控制 ui测试 dagger2 retrofit2 compose rxjava2 五险一金 补充医疗保险 定期体检
ios,广州宜健邦科技有限公司,广州,15000.0,3年及以上 大专 计算机 c++ 数据结构 app 代码编写 编码 json 多线程 swift ios 五险一金 带薪病假 年终奖金 专业培训 定期体检 零食下午茶 定期团建
前端开发,四川沐之爱养老服务有限公司,成都,4000.0,1-3年 大专 jquery 开发 html5 git 前端开发 web app easyui uniapp 微信小程序 周末双休 节日福利 弹性工作 节假日福利
ios,利优科技资讯服务（深圳）有限公司,天津,30000.0,8年及以上 本科 ios swift objective_c spm ui sdk 英文 五险一金 年终奖金 绩效奖金 专业培训 弹性工作 周末双休 带薪年假 补充医疗保险 通讯补贴 免费班车 补充公积金 方案 正式位置
前端开发,贵州安盛科技技术服务有限公司,遵义,7000.0,无需经验 大专 css html javascript 需求分析 vue 前端 react 前端框架 用户体验 前端页面开发 五险一金 年终奖金 带薪年假 周末双休 方案
android,广东好太太科技集团股份有限公司,广州,10000.0,3年及以上 本科 计算机 测试 开发 性能测试 代码编写 自动化测试 多线程 物联网 上线 ui框架 五险一金 年终奖金 餐饮补贴 周末双休 节日福利 带薪年假 免费班车
