job_name,company_name,city,salary,jd_text
运维开发,北京派科思诺网络科技有限责任公司,北京,9000.0,无需经验 本科 计算机 linux windows 网络 it 服务器 安全检查 维护管理 it设备 系统故障 五险一金 年终奖金 绩效奖金 交通补贴 带薪年假 周末双休 节日福利 弹性工作
运维工程师,河北电网新能源集团有限公司,新乡,5000.0,无需经验 中技/中专 维护 安全检查 检修 电力 保养 高低压证 巡检 电站 安全操作 安全培训 五险一金 年终奖金 定期体检 绩效奖金 专业培训 餐饮补贴 交通补贴 带薪年假 节日福利 高温补贴 奖金 带薪休假 提供食宿 培训 全勤
运维工程师,河北胜赞轨道交通有限公司,锦州,5000.0,无需经验 中技/中专 网络 维护保养 故障处理 办公设备 设备巡检 维修记录 afc系统 五险一金 上五休二 公司福利 五险一金 包吃住 绩效奖金 员工旅游 节日福利 做五休二 晋升空间
运维工程师,上海浦东工程建设管理有限公司,上海,面议,3年及以上 本科 计算机 数据库 bim 运维 维护 操作系统 性能调优 人工智能 故障排除 系统优化 五险一金 定期体检 带薪年假 节日福利 周末双休 补充医疗保险 补充公积金
网络安全工程师,浙江天祥质量技术服务有限公司杭州分公司,杭州,12000.0,1年及以上 本科 测试 软件工程 英文 技术培训 网络安全 物联网 wifi 蓝牙 计算机科学 cet四级 培训 五险一金 带薪年假 带薪病假 年终奖金 专业培训 定期体检 有餐补 交通补贴 出差补贴
运维工程师,森根新能源（浙江）有限公司,嘉兴,12000.0,5年及以上 本科 数据库 数据分析 erp vue plc c# 多线程 mes 用户培训 wms 培训 方案 五险一金 带薪年假 年终奖金 绩效奖金 定期体检 节日福利 周末双休 专业培训
运维工程师,上海狩利信息科技有限公司,长沙,8000.0,无需经验 大专 计算机 办公软件 linux windows 网络 服务器 维护 系统维护 计算机软硬件 系统升级 五险一金 年终奖金 定期体检 绩效奖金 专业培训 餐饮补贴 通讯补贴 带薪年假 周末双休 节日福利 弹性工作 做五休二 高温补贴 五险 团队氛围
系统工程师,安徽恩博力电器有限公司,滁州,8000.0,无需经验 硕士 测试 cad 结构设计 电路设计 系统集成 仿真验证 装配调试 三维建模 供应商沟通 电气工程师 方案 五险一金 专业培训 绩效奖金 年终奖金 定期体检 带薪年假 节假日福利 规范管理 扁平管理 技能培训
运维工程师,四川华西集采电子商务有限公司,成都,面议,5年及以上 本科 数据库 维护 系统运维 配置管理 数据安全 运行监控 招采系统 用户支持 巡检 脚本执行 五险一金 定期体检 餐饮补贴 带薪年假 节日福利 周末双休 补充医疗保险 企业年金
网络安全工程师,工业和信息化部电子第五研究所,成都,15000.0,1-3年 本科 java c++ c# php 网络安全 渗透测试 代码审计 漏洞修复 fortify 五险一金 年终奖金 定期体检 餐饮补贴 带薪年假 周末双休 节日福利 培训 购买五险
运维工程师,深圳达实智能股份有限公司,深圳,14000.0,2年及以上 本科 解决方案 运维 shell 服务器 故障处理 应急预案 软件系统 环境搭建 监控系统 操作手册 内部培训 方案 培训 五险一金 员工旅游 专业培训 绩效奖金 股票期权 定期体检
自动化运维工程师,上海敏友环境检测技术有限公司,上海,5000.0,2年及以上 大专 环境检测 检测运维 仪器检修 绩效奖金 周末双休 全勤奖 五险一金 不加班 节日福利 定期体检 导师制 带薪年假 年终奖金 有餐补 出差补贴 定期团建
网络工程师,贵州恒创顺互联网科技有限公司,昆明,7000.0,无需经验 本科 网络 网络系统 网络安全策略 网络稳定性 计算机 IT 运维 数据分析 开发 可视化 五险一金 补充医疗保险 免费班车 员工旅游 交通补贴 餐饮补贴 通讯补贴 专业培训 绩效奖金 年终奖金 定期体检 周末双休 享受法定节日
网络工程师,武汉喻芯半导体有限公司,武汉,8000.0,3年及以上 本科 计算机 linux 运维 it 服务器 系统集成 网络安全 网络设备 故障排除 zabbix 交通补贴 餐饮补贴 通讯补贴 年终奖金 定期体检 六险一金 双休
网络工程师,重庆戴卡捷力轮毂制造有限公司,重庆,7000.0,3年及以上 本科 计算机 数据分析 需求分析 项目管理 sql erp 自动化 sap 金蝶 质量管理 五险 带薪年假 年终奖金 绩效奖金 项目奖金 有餐补 出差补贴 达产奖励 专业培训 节日礼品
网络工程师,东莞市彦昊电子科技有限公司,深圳,6000.0,1年及以上 本科 入职培训 羽毛球 开发测试 户外拓展 乒乓球 互联网技术 学习交流 户外运动 员工宿舍 周末双休 双休 员工生日 入职培训 生日会 节假日 培训 聚餐
网络工程师,上海荣特达智能科技有限公司,上海,10000.0,2年及以上 本科 java mysql 数据库 erp 编程 金蝶 运维 shell oa tcp 五险一金 补充医疗保险 补充公积金 员工旅游 交通补贴 餐饮补贴 年终奖金 定期体检 通讯补贴 绩效奖金
网络安全工程师,广州赛宝认证中心服务有限公司,重庆,15000.0,3年及以上 本科 计算机 通信 项目实施 网络 软件 大数据 技术方案 数据安全 安全理论 信息安全 五险一金 年终奖金 定期体检 绩效奖金 专业培训 餐饮补贴 通讯补贴 带薪年假 周末双休 节日福利 带薪病假 有餐补
网络工程师,前锦网络信息技术（上海）有限公司,武汉,6000.0,3年及以上 本科 计算机 调试 网络安全 设备安装 交换机 网络设备 系统上线 酒店 局域网 tcp/ip协议 五险一金 补充医疗保险 带薪年假 带薪病假 项目奖金 年终奖金 定期体检 定期团建 通讯补贴
网络工程师,浙江兆龙互连科技股份有限公司,湖州,5000.0,1-3年 本科 销售 计算机 数据库 javascript sql erp 运维 oa crm 系统集成 培训 五险一金 员工旅游 股票期权 专业培训 有餐补 免费班车 包住
运维工程师,上海寰球工程有限公司,上海,7000.0,无需经验 本科 IT 网络工程师 桌面支持 五险一金 年终奖金 定期体检 绩效奖金 餐饮补贴 交通补贴 节日福利 带薪年假 周末双休 补充医疗保险 弹性工作 做五休二 高温补贴
运维工程师,杭州衡驰科技有限公司,杭州,5000.0,1年及以上 大专 svn git 理工 版本管理 配置管理 开发环境搭建 提测 产品库管理 gerrit 五险一金 年终奖金 定期体检 绩效奖金 专业培训 餐饮补贴 带薪年假 节日福利 周末双休
运维工程师,江苏由甲申田新能源科技有限公司,常州,6000.0,2年及以上 大专 培训 mysql oracle 数据库 sql c# 维护 mes 系统维护 物料管理 方案 培训 五险一金 带薪年假 带薪病假 年终奖金 专业培训 定期体检 租房补贴 免费班车 出差补贴 定期团建
运维工程师,中健科信息技术有限公司,广州,6000.0,2年及以上 大专 方案设计 解决方案 运维 技术交流 故障处理 写作 电工证 制冷 宣讲 方案撰写 方案 能力优先 五险一金 带薪年假 员工旅游 年终奖金 绩效奖金 专业培训 零食下午茶 带薪病假
系统工程师,江西聚变新能源有限责任公司,合肥,25000.0,3年及以上 硕士 氦低温 低温仪器 ansys仿真 制冷系统设计 冷压缩机 工程热力学 真空 传热学 方案 五险一金 带薪年假 带薪病假 绩效奖金 项目奖金 定期体检 免费工作餐
运维工程师,河南今日通信科技有限公司,郑州,3000.0,无需经验 大专 外场测试 数据验证 通信保障 一致性核查 现场测试 测试手机 dt 场景测试 数据规划 cqt 五险一金 补充医疗保险 补充公积金 餐饮补贴 通讯补贴
网络安全工程师,港品局合格评定（深圳）有限公司广州分公司,广州,10000.0,3年及以上 本科 waf cisa linux windows 防火墙 渗透测试 认证证书 tcp 网络安全 cisp 补充医疗保险 员工旅游 五险一金 周末双休 带薪年假 专业培训
运维工程师,河北电网新能源集团有限公司,郑州,5000.0,无需经验 中技/中专 维护 安全检查 检修 电力 保养 高低压证 巡检 电站 安全操作 安全培训 五险一金 年终奖金 定期体检 绩效奖金 专业培训 餐饮补贴 交通补贴 带薪年假 节日福利 高温补贴 奖金 带薪休假 提供食宿 培训 全勤
网络工程师,河北肖豪科技有限公司,济南,5000.0,在校生/应届生 大专 计算机 机械 机电 电子信息 理工 操作系统 物联网 信息安全 云计算 晋升 五险一金 员工旅游 通讯补贴 年终奖金 绩效奖金 补充医疗保险 免费班车 交通补贴 餐饮补贴 定期体检
系统集成工程师,上海讯利船舶工程有限公司,上海,10000.0,3年及以上 本科 卫星通讯 售前技术支持 制图 物联网 信息工程 网络架构 网络安全 通信 通讯与导航 五险一金 年终奖金 绩效奖金 定期体检 专业培训 餐饮补贴 通讯补贴 交通补贴 员工旅游 五险
运维工程师,石家庄动途轨道交通有限公司,太原,5000.0,无需经验 中技/中专 计算机 机械 维修 电气 设备检修 故障处理 维护保养 机电一体化 巡检 afc系统 五险一金 年终奖金 定期体检 绩效奖金 专业培训 餐饮补贴 交通补贴 带薪年假 节日福利 五险 餐补 晋升空间 上五休二 培训 住宿
运维开发,北京先进数通信息技术股份公司,佛山,8000.0,3年及以上 本科 java mysql 数据库 redis sqlserver vue.js zabbix 金融业 it运维 cmdb 五险一金 年终奖金 定期体检 餐饮补贴 带薪年假 周末双休
网络工程师,北京中亦安图科技股份有限公司,广州,15000.0,3-5年 大专 网络 cisco 网络改造 路由协议 无线网络 故障处理 路由 方案 五险一金 补充医疗保险 通讯补贴 专业培训 出国机会 股票期权 定期体检 年终奖金
系统集成工程师,上海夷都科技有限公司,上海,8000.0,无需经验 本科 计算机 办公软件 需求分析 调试 plc 功能测试 产品开发 安装 软件 传感器 绩效奖金 年终奖金 定期体检 五险一金 出国机会 员工旅游 餐饮补贴 专业培训 绩效奖金 弹性工作 定期体检
网络安全工程师,北京讯通通信服务有限公司广州分公司,佛山,15000.0,3年及以上 本科 security ueba mitigation analytics 五险一金 定期体检 绩效奖金 专业培训 补充医疗保险 带薪年假 节日福利 子女医疗保险 带薪病假 员工旅游 通讯补贴
系统工程师,东风汽车集团股份有限公司,武汉,15000.0,3年及以上 本科 自动化 车辆工程 架构设计 机械工程 需求管理 技术标准 整车 降成本 技术规划 设计指南 年终奖金 绩效奖金 定期体检 餐饮补贴 通讯补贴 带薪年假 交通补贴 节日福利 免费班车 周末双休 弹性工作 补充公积金 做五休二 新能源 方案
自动化运维工程师,云南格维科技有限责任公司,保山,5500.0,3年及以上 本科 计算机 测试 cad 调试 plc 编程 电气自动化 变频器 识图 西门子 年终奖金 绩效奖金 专业培训 定期体检 带薪年假 全勤奖 五险 项目奖金 零食下午茶 定期团建 驻场补贴
运维工程师,乐孜芯创半导体设备（上海）有限公司,上海,7000.0,1-3年 大专 计算机 办公软件 维修 office 电脑 网络 文档编写 tcp 技术文档 oa系统 五险一金 补充医疗保险 餐饮补贴 通讯补贴 交通补贴 员工旅游 专业培训 出国机会 绩效奖金 年终奖金
运维工程师,上海益中亘泰（集团）股份有限公司,上海,15000.0,5年及以上 本科 管理 物业 物业行业 网络安全 信息系统 房产行业 实施推广 现场运作 hls 信息安全 培训 方案 五险一金 绩效奖金 定期体检 节日福利 团建活动 专业培训
网络工程师,上海艾杰飞人才管理咨询有限公司,苏州,6000.0,2年及以上 本科 供应商管理 环境管理 办公环境 维护管理 办公用品采买 行政管理 IT设计运维 办公设备 运营实施 信息安全 保险 全职 方案 培训 五险一金 补充医疗保险 带薪年假 带薪病假 定期体检
系统集成工程师,晟玄互联网科技（南京）有限公司,南京,8000.0,2年及以上 大专 计算机 调试 验收 自动化 文档编写 电子信息 用户培训 系统集成 现场实施 系统搭建 周末双休 项目奖金 带薪年假 五险一金 节日福利 年终奖金 交通补助 团建活动 年度体检
运维工程师,河北飞旭电力科技有限公司,淮南,5500.0,无需经验 大专 机械 自动化 维护 保养 设备维护计划 机组设备 检查 设备改造升级 五险一金 奖金 高温补贴 年终奖 晋升空间 晋升 补助 底薪 工龄工资 岗位津贴
网络工程师,上海华讯网络系统有限公司,北京,15000.0,3年及以上 本科 计算机 英语 方案设计 技术培训 通信工程 网络技术 ccnp 技术支持服务 网络优化方案 网络行业 五险一金 补充医疗保险 补充公积金 交通补贴 通讯补贴 定期体检 年终奖金 专业培训 方案 培训 绩效奖金 弹性工作
系统工程师,芯曜鑫技术(上海)有限公司,上海,15000.0,3-5年 本科 开发 计算机 数据分析 项目计划 自动化开发 供应链 五险一金 年终奖金 绩效奖金 定期体检 专业培训 餐饮补贴 带薪年假 交通补贴 节日福利 补充医疗保险 周末双休 补充公积金
运维工程师,河北电网新能源集团有限公司,邢台,5000.0,无需经验 中技/中专 维护 安全检查 检修 电力 保养 高低压证 巡检 电站 安全操作 安全培训 五险一金 年终奖金 定期体检 绩效奖金 专业培训 餐饮补贴 交通补贴 带薪年假 节日福利 高温补贴 奖金 带薪休假 提供食宿 培训 全勤
运维工程师,北京伯凯科技有限公司,上海,20000.0,10年及以上 本科 sop gcp 安全 saas 防火墙 devops aws 路由 lte ospf 带薪病假 工会福利 社保 五险一金 持续发展 职业发展 方案 培训 福利年假 500强 节假日
系统集成工程师,上海中集洋山物流装备有限公司,上海,面议,3年及以上 本科 cad 自动化 solidworks 电气 设计软件 设计方案 结构 技术文档 电气工程 现场安装调试 五险一金 餐饮补贴 定期体检 免费班车 交通补贴 员工旅游 年终奖金 专业培训 绩效奖金
网络工程师,煦实信息科技（上海）有限公司,上海,20000.0,7年及以上 大专 网络 网络安全 交换机 信息系统 计算机科学 故障排查 vpn 网络管理 路由 局域网 五险一金 年终奖金 绩效奖金 定期体检 专业培训 员工旅游 节日福利 带薪年假 周末双休 做五休二 高温补贴 方案
网络工程师,武汉多恩投资有限公司,武汉,5000.0,3年及以上 本科 linux erp windows 网络安全 系统维护 打印机 办公设备 故障排除 计算机科学 培训 出国机会 员工旅游 专业培训 绩效奖金 年终奖金 定期体检 五险 定期团建 出差补贴
运维工程师,河北电网新能源集团有限公司,吴忠,6000.0,无需经验 中技/中专 维护 安全检查 检修 电力 保养 高低压证 巡检 电站 安全操作 安全培训 五险一金 年终奖金 定期体检 绩效奖金 专业培训 餐饮补贴 交通补贴 带薪年假 节日福利 高温补贴 奖金 带薪休假 提供食宿 培训 全勤
运维工程师,湖北江华机械有限公司,襄阳,5000.0,3年及以上 大专 计算机 it 维护保养 计算机软硬件 局域网 安装验收 故障报修 局域网搭建 erp系统上线 带薪年假 绩效奖金 专业培训 包住宿 餐饮补贴 五险一金 定期体检 年终奖金 员工旅游 股票期权
网络工程师,深圳市派沃新能源科技股份有限公司,惠州,15000.0,5年及以上 本科 管理 项目管理 团队管理 it 技术方案 技术培训 控制成本 英语听说读写 it行业 战略规划 培训 方案 五险一金 年终奖金 绩效奖金 股票期权 弹性工作 合伙人模式 带薪年假 项目奖金 专业培训
运维工程师,准特科技（苏州）有限公司,苏州,8000.0,3年及以上 大专 计算机 linux 网络 it 操作系统 维护管理 故障排查 网络故障 it系统 网络设备配置 培训 五险一金 带薪年假 员工旅游 年终奖金 绩效奖金 定期体检 免费工作餐 定期团建
网络工程师,陕西科隆新材料科技股份有限公司,咸阳,4000.0,3-5年 本科 培训 erp 软件开发 软件工程 mes 电子信息工程 plm 软件维护 五险一金 定期体检 提供住宿 法定节假 职业发展 食宿 午餐 节日礼品 节假日 年休假 年底奖金 培训 晋升空间 补助 晋升
运维工程师,西安布质科技有限责任公司,烟台,8000.0,无需经验 大专 linux hadoop 系统维护 系统运维 问题排查 大数据系统 系统监控 hbase storm 五险一金 年终奖金 定期体检 绩效奖金 专业培训 餐饮补贴 通讯补贴 员工旅游 带薪年假 节日福利 周末双休 弹性工作 做五休二 五险 高温补贴
运维工程师,科学城（广州）数字科技集团有限公司,广州,15000.0,5年及以上 本科 数据分析 linux 运维 软件工程 性能测试 架构设计 hadoop 信息管理 spark 优化方案 五险一金 定期体检 通讯补贴 交通补贴 补充医疗保险 工作餐
网络工程师,河北肖豪科技有限公司,廊坊,5000.0,在校生/应届生 大专 计算机 电子信息 理工 晋升 信息安全 技术交流培训 物联网 操作系统 机械 五险一金 员工旅游 通讯补贴 年终奖金 绩效奖金 补充医疗保险 免费班车 交通补贴 餐饮补贴 定期体检
运维工程师,中山大洋电机股份有限公司,中山,8000.0,3年及以上 本科 linux 虚拟网络 监控方案 bgp evpn tcp/ip dpdk 容器 vpp ebpf 五险一金 年终奖金 定期体检 餐饮补贴 带薪年假 节日福利 周末双休
网络工程师,苏州口腔医院（集团）有限公司,苏州,6000.0,1年及以上 本科 mysql oracle 数据库 数据分析 jquery css html javascript sql 前端开发 五险一金 年终奖金 绩效奖金 定期体检 餐饮补贴 带薪年假 节日福利 交通补贴 周末双休 做五休二 能力优先
运维工程师,威伊艾姆电机（中国）有限公司,无锡,10000.0,5年及以上 本科 计算机 erp oa it mes pmc plm 可靠性 管理维护 软件部署 培训 方案 五险一金 补充医疗保险 员工旅游 餐饮补贴 年终奖金 出国机会
运维工程师,安阳呈泰信息技术服务有限公司,北京,9000.0,1年及以上 大专 计算机 需求分析 通信 方案设计 网络 运维 技术方案 信息化 项目规划 系统架构 方案 五险一金 带薪年假 员工旅游 年终奖金 绩效奖金 定期体检 定期团建 零食下午茶 项目奖金 补充医疗保险
自动化运维工程师,捷普集团-绿点科技 （深圳）有限公司,深圳,9000.0,1-2年 本科 自动化 英语六级 口语流利 五险一金 年终奖金 绩效奖金 专业培训 餐饮补贴 带薪年假 节日福利 包住宿 包吃 加班补贴 商业保险 全额社保 累积社会工龄
运维工程师,西安布质科技有限责任公司,西安,8000.0,无需经验 本科 计算机 linux windows 网络 运维 shell 文档编写 http tcp 编程语言 五险一金 年终奖金 绩效奖金 专业培训 节日福利 周末双休 弹性工作 做五休二 高温补贴 五险
网络工程师,南京泰通科技股份有限公司,南京,8000.0,2年及以上 本科 办公软件 excel word 设备维护 网络优化 无线网络 无线网络优化 设备开通 故障分析报告 优化调整 五险一金 免费班车 餐饮补贴 专业培训 年终奖金
运维工程师,上海联和科海材料科技有限公司,上海,6000.0,3年及以上 大专 运维 机电 安全员c证 运维管理 监察 环境工程 环保 安全 安全员 膜清洗 五险一金 年终奖金 定期体检 绩效奖金 餐饮补贴 带薪年假 周末双休 节日福利 做五休二 高温补贴
运维工程师,上海外服合杰企业服务有限公司,上海,12000.0,5年及以上 本科 管理 测试 财务 项目管理 金融 会计 运维 文档编写 费用报销 经济 意外险 年终奖 五险一金 年终奖金 定期体检 方案 年度体检 高温费 年节福利
网络安全工程师,广州赛宝认证中心服务有限公司,广州,15000.0,3年及以上 本科 计算机 通信 项目实施 网络 软件 大数据 技术方案 数据安全 安全理论 信息安全 五险一金 年终奖金 定期体检 绩效奖金 专业培训 餐饮补贴 通讯补贴 带薪年假 周末双休 节日福利 带薪病假 有餐补
系统工程师,深圳市汇鼎智能制造技术有限公司,深圳,15000.0,3年及以上 大专 mysql oracle 数据库 css html javascript vue sqlserver 编程 SQLServer 方案 五险 带薪年假 带薪病假 绩效奖金 包吃 交通补贴 定期体检 零食下午茶
运维工程师,协鑫集成,合肥,8000.0,1年及以上 大专 计算机 电子 erp 开发 调试 软件开发 运维 系统测试 tcp 信息管理 五险一金 定期体检 专业培训 餐饮补贴 通讯补贴 交通补贴 带薪年假
运维工程师,广州智光储能科技有限公司,广州,5000.0,1年及以上 中技/中专 数据分析 自动化 安全管理 维护 维护保养 安全检查 故障处理 安全培训 电力 高压电工证 五险一金 年终奖金 定期体检 绩效奖金 专业培训 带薪年假 免费班车 培训 项目奖金 有餐补 定期团建
运维工程师,泰康科技有限公司,北京,25000.0,5年及以上 本科 计算机 运维 paas 云计算平台 数据库 架构设计 容器平台 分布式存储 五险一金 年终奖金 绩效奖金 通讯补贴 交通补贴 带薪年假 周末双休 补充医疗保险 免费班车 方案
网络安全工程师,成都久信信息技术股份有限公司,贵阳,7000.0,3年及以上 本科 计算机 项目实施 网络安全 差距分析 等保测评 应用安全测评 主机安全测评 物理安全测评 数据安全测评 技术支持 五险一金 带薪年假 周末双休 交通补贴 餐饮补贴 通讯补贴 绩效奖金 员工旅游 定期体检 节假日 方案
网络工程师,上海艾杰飞人才管理咨询有限公司,深圳,14000.0,5年及以上 大专 培训 项目管理 方案设计 运维 it 服务器 英语四级 社内SE 系统运维 资产管理 全职 方案 培训 五险一金 补充医疗保险 带薪年假 带薪病假 定期体检
运维工程师,广州白云山潘高寿药业股份有限公司,广州,10000.0,5年及以上 本科 计算机 运维 软件工程 防火墙 降低成本 数据支持 用户运营 系统运维 五险一金 年终奖金 定期体检 带薪年假 节日福利 周末双休 免费班车 培训
运维工程师,长三角国创超声（上海）有限公司,上海,12000.0,2年及以上 本科 计算机 网络安全 系统安装 供电 dns dhcp 网络规划 网络故障 局域网 服务器虚拟化 五险一金 免费班车 交通补贴 员工旅游 餐饮补贴 年终奖金 绩效奖金 定期体检
系统工程师,佛山键讯科技有限公司,广州,7000.0,1年及以上 大专 linux windows 防火墙 防病毒 英文书写 粤语听说 ms office it helpdesk 专业培训 带薪年假 做五休二 加班补贴 五险 带薪病假 零食下午茶
自动化运维工程师,福建汉特云智能科技有限公司,福州,5000.0,2年及以上 本科 售后服务体系 售后服务 供应商管理 日常运营监控 规范服务流程 售后支持 客户关系维护 售后调试管理 问题排查 售后问题解决 五险一金 年终奖金 绩效奖金 专业培训 定期体检 餐饮补贴 通讯补贴 交通补贴 带薪年假 节日福利 周末双休 高温补助
运维工程师,惠州三华工业有限公司,惠州,7000.0,2年及以上 本科 销售 计算机 java mysql 财务 开发 sqlserver 功能测试 金蝶 解决方案 培训 方案 五险一金 免费班车 员工旅游 专业培训 年终奖金 定期体检 节日礼品 年度旅游
运维工程师,广东绿力网络技术有限公司,广州,7000.0,2年及以上 大专 计算机 oracle 数据库 维护客户关系 软件实施 his hrp 分析客户需求 实施上线 信管 周末双休 五险一金 产假 带薪假期 年假 有五险 餐饮补贴 通讯补贴 专业培训 年终奖金 弹性工作 员工旅游 定期体检
运维工程师,杭州积海半导体有限公司,杭州,面议,在校生/应届生 本科 计算机 打印机 办公设备 会议系统 it设备 windows系统 维护及管理 桌面技术支持 maxhub 五险一金 年终奖金 定期体检 绩效奖金 餐饮补贴 带薪年假 周末双休 补充医疗保险 弹性工作 免费班车 提供住宿
运维工程师,石家庄动途轨道交通有限公司,邯郸,5000.0,无需经验 中技/中专 机械 维修 电气 设备检修 afc系统 巡检 故障处理 维护保养 机电一体化 工单 五险一金 年终奖金 定期体检 绩效奖金 专业培训 餐饮补贴 交通补贴 带薪年假 节日福利 五险 餐补 晋升空间 上五休二 培训 住宿
运维工程师,北京垣械电子科技有限公司,合肥,7000.0,无需经验 本科 计算机 数据库 自动化 网络 维护 调优 运营维护 网络故障 局域网 信息工程 绩效奖金 年终奖金 补充医疗保险 弹性工作 定期体检 员工旅游 交通补贴 五险一金 餐饮补贴 周末双休 全职 通讯补贴 节日福利 专业培训 带薪年假
