job_name,company_name,city,salary,jd_text
性能测试,武汉新锐合金工具有限公司,武汉,3500.0,1年及以上 大专 机械 化工 材料 质量检测 实验报告 结果分析 样品测试 检测设备 试验操作 机械性能测试 五险一金 年终奖金 绩效奖金 专业培训 定期体检 带薪年假 节日福利 包吃 包住宿 方案
通信测试工程师,上海爱辉通信技术有限公司,上海,10000.0,5-10年 本科 芯片测试 测试工具 通信原理 英语听说读写 mtk 高通 外场测试 实验室测试 log 技术支持 年终奖 五险一金 出差补贴 定期团建 员工旅游 专业培训 定期培训
测试工程师,深圳市佳贤通信科技股份有限公司,深圳,12000.0,3-5年 本科 调试 通信 spark 测试用例设计 现场支持 路测软件 鼎利 开发定位 五险一金 专业培训 加班费 补充公积金 出国机会 绩效奖金 年终奖金 股票期权 弹性工作 定期体检
测试工程师,聚辰半导体股份有限公司,上海,7500.0,在校生/应届生 本科 c++ 自动化 电力 通信 测试硬件 测控技术仪器 测试进程 五险一金 补充医疗保险 员工旅游 餐饮补贴 专业培训 绩效奖金 年终奖金 定期体检
硬件测试工程师,深圳市鼎泰佳创科技有限公司,深圳,15000.0,4年及以上 本科 自动化 eol 电气系统设计 域控制器 FPGA开发 汽车电子 电子工程 ASIC集成电路 测试设备开发 测试台架 五险一金 年终奖金 带薪年假 包食宿
游戏测试,徐州松正网络科技有限公司,北京,面议,无需经验 测试 游戏 安卓 游戏功能测试 手游试玩 游戏试玩 日结 居家办公 大学生 兼职 佣金 带薪年假 年终奖金 绩效奖金 项目奖金 专业培训 免费工作餐 出差补贴 零食下午茶 定期体检 定期团建
测试工程师,深圳市威科达科技有限公司,东莞,12000.0,5-7年 本科 测试环境 测试 自动化 测试方案 伺服驱动器 项目测试 运动控制器 ethercat总线 codesys 测试计划 五险一金 餐饮补贴 专业培训 年终奖金 弹性工作 定期体检
测试工程师,卧龙控股集团有限公司,绍兴,15000.0,3年及以上 本科 测试 自动化 测试方案 产品测试 电子信息工程 技术文档 测试文档 问题跟踪 测试结果 结果评估 新能源 五险一金 餐饮补贴 专业培训 绩效奖金 年终奖金 方案
功能测试,艾珍机械设备制造(上海)有限公司,上海,8000.0,3年及以上 高中 测试 自动化 性能测试 测试流程 压缩机 测试标准 机械电子 生产测试 测试分析 鼓风机 五险一金 年终奖金 定期体检 专业培训 员工旅游 节日福利 带薪年假 补充医疗保险 周末双休 免费班车 全勤奖
测试工程师,费勉仪器科技（上海）有限公司,上海,面议,1年及以上 本科 测试 机械 需求分析 测试用例 团队管理 功能测试 半导体 安装调试 性能测试 材料 五险一金 年终奖金 绩效奖金 餐饮补贴 带薪年假 补充医疗保险 节日福利 周末双休
测试工程师,麦格纳汽车系统常州有限公司,常州,10000.0,5年及以上 本科 测试 验证 机械工程 机电工程 汽车工程 开发新产品 testing engineering 电子工程 五险一金 员工旅游 交通补贴 餐饮补贴 免费班车 通讯补贴 年终奖金 专业培训 弹性工作 定期体检
测试经理,广东志达精密管业制造股份有限公司,佛山,8000.0,3年及以上 大专 培训 处理客户投诉 产品审核 质量 产品检验 产品改进 检验指导 客户验货 生产过程质量 过程质量数据 五险一金 全勤奖 节日福利 带薪年假 包住宿 员工旅游 餐饮补贴 专业培训 定期体检
测试工程师,江苏威进智控科技有限公司,北京,20000.0,5年及以上 本科 测试 调试 软件开发 电气 文档编写 代码编写 软件 测试流程 电机控制 五险一金 餐饮补贴 定期体检 绩效奖金 交通补贴 通讯补贴 带薪年假 节日福利 周末双休 带薪病假 项目奖金
软件测试,深圳市鼎盛光电有限公司,惠州,3000.0,1年及以上 测试 测试用例 软件测试 性能测试 产品测试 测试工具 bug管理 产品改进 用户界面 测试结果 带薪培训 培训 五险一金 带薪年假 带薪病假 员工旅游 绩效奖金 项目奖金 专业培训 零食下午茶 包住 出差补贴
测试工程师,常州拜特测控技术有限公司,常州,6000.0,2年及以上 本科 功能测试 性能测试 用户手册 样品测试 培训资料 测试报告 示波器 电烙铁 模拟电路 数字电路 餐饮补贴 房补 五险一金 业绩奖金 年终奖金 公司旅游 专业培训 定期体检
测试开发,深圳市创想三维科技股份有限公司,深圳,10000.0,2年及以上 本科 自动化 linux c++ shell 3d打印 白盒测试 测试框架 智能硬件 嵌入式系统 固件 五险一金 年终奖金 专业培训 带薪年假 节日福利 周末双休
测试工程师,上海班德瑞工业用品有限公司,上海,10000.0,4年及以上 本科 测试 需求分析 软件开发 软件测试 自动化测试 selenium 测试工具 测试流程 计算机科学 junit 五险一金 带薪年假 带薪病假 绩效奖金 年终奖金 员工旅游 定期体检
软件测试,上海汇检灼越仪器科技有限公司,上海,面议,在校生/应届生 本科 计算机 mysql 数据库 需求分析 项目管理 erp c# oa crm 电子信息 五险一金 定期体检 绩效奖金 员工旅游 带薪年假 周末双休 节日福利 做五休二
测试工程师,中山科美视通科技有限公司,中山,8000.0,3年及以上 本科 数据库 数据分析 验收 自动化 软件开发 安装调试 良率 uph labview 应用开发 五险一金 专业培训 餐饮补贴 员工旅游 带薪年假 方案 培训 5.5天工作制 加班补贴 住房补贴
测试工程师,南京伟测半导体科技有限公司,南京,10000.0,无需经验 本科 数据分析 电子 测试 自动化 半导体 示波器 文档编写 万用表 芯片测试 电路 五险一金 补充医疗保险 交通补贴 餐饮补贴 通讯补贴 绩效奖金 年终奖金 定期体检 专业培训
功能测试,桂林深科技有限公司,桂林,4000.0,2年及以上 中技/中专 测试 机械 调试 维护 工艺流程 测试流程 测试验证 问题处理 设备操作 电气维修 培训 五险一金 餐饮补贴 绩效奖金 年终奖金 定期体检
游戏测试,徐州松正网络科技有限公司,杭州,面议,无需经验 试玩 游戏测试 游戏试玩 手游试玩 手游测试 日结 大学生 居家办公 年终奖金 绩效奖金 定期体检 专业培训 弹性工作 带薪年假 时间自由 佣金 项目奖金 出差补贴 零食下午茶 定期团建
测试工程师,科讯工业制造（深圳）有限公司,深圳,12000.0,5年及以上 大专 测试 测试用例 功能测试 示波器 性能测试 万用表 系统测试 产品测试 压力测试 机械工程 年终奖金 绩效奖金 带薪年假 节日福利 方案 五险 专业培训 补充医疗保险 带薪病假 员工旅游 定期体检 有餐补
测试工程师,广州爱梵得科技有限公司,广州,6000.0,无需经验 大专 测试 机械 化工 售前 机械工程 产品改进 3d打印机 产品测试计划 机械测试 测试报告 带薪年假 年终奖金 全勤奖 绩效奖金 节日福利 通讯补贴 员工旅游 社保
测试工程师,深圳市时创意电子股份有限公司,深圳,8000.0,2年及以上 本科 编程 windows shell 测试环境 技术交流 产品测试 测试设备 测试工具 嵌入式 emmc 五险一金 绩效奖金 年终奖金 包吃包住 工龄奖 下午茶 节日福利 法定节假日 带薪年假 部门聚餐
测试开发,重庆已成科技有限公司,重庆,8000.0,3年及以上 本科 mysql 测试 需求分析 redis 软件开发 kafka mongodb 中间件 技术指导 关系型数据库 带薪年假 餐补 五险一金 年度体检 年度旅游 节日礼物
测试工程师,蓝思科技股份有限公司,长沙,9000.0,5年及以上 大专 电子 通信 质量改善 精益改善 产品试制 人员考核 线体 dfx 笔电 降低误测率 带薪年假 五险一金 包住宿 免费班车 绩效奖金 节日福利 专业培训 加班补贴 方案
软件测试,大族激光科技产业集团股份有限公司,深圳,10000.0,3年及以上 本科 计算机 oracle linux 测试 sql 功能测试 软件测试 软件工程 性能测试 自动化测试 新能源 方案 五险一金 免费班车 交通补贴 餐饮补贴 通讯补贴 专业培训 年终奖金 定期体检 员工旅游 绩效奖金
测试工程师,深圳天邦达科技有限公司,深圳,15000.0,5年及以上 本科 测试 示波器 系统测试 可靠性测试 新能源 产品质量 储能 白盒测试 配电柜 定位分析 新能源 绩效奖金 年终奖金 员工旅游 五险一金 节日福利 专业培训 方案
硬件测试工程师,（香港）寰宇有限公司东莞代表处,东莞,8000.0,3年及以上 本科 计算机 测试 需求分析 测试用例 通信 wifi 硬件 蓝牙 测试文档 ipc 五险一金 年终奖金 定期体检 员工旅游 带薪年假 弹性工作 节日福利 周末双休
测试开发,意拉德电子（东莞）有限公司,东莞,12000.0,3年及以上 本科 办公软件 电子 c# 自动化测试 人员培训 英语读写 测试设备 设计开发 labview 测量仪器 培训 方案 五险一金 出国机会 年终奖金 弹性工作 幼儿看护中心 专业培训
测试工程师,鞍山科世科汽车部件有限公司,鞍山,6000.0,3年及以上 本科 调试 维护保养 test 调试安装 设备订购 dpt debugging ept foaming 五险一金 定期体检 绩效奖金 带薪年假 交通补贴 补充医疗保险 节日福利 周末双休
游戏测试,深圳市曼妤科技有限公司,深圳,5000.0,无需经验 大专 计算机 办公软件 excel word ppt 晋升 游戏测试 晋升管理 it互联网 人才成长 五险一金 包住 年终奖 带薪年假 周末双休 餐补 朝九晚六 节假日 氛围好 晋升机制 购买五险 环境优美 人性化 午餐 住宿
软件测试,重庆企强人力资源管理有限公司,深圳,5000.0,无需经验 本科 计算机 测试用例 jmeter 软件测试 postman 测试工具 兼容性测试 测试效率 测试流程优化 问题分析 五险一金 带薪年假 年终奖金 绩效奖金 零食下午茶 包吃 包住 定期团建 定期体检 免费工作餐
测试工程师,武汉光庭信息技术股份有限公司,宁波,8000.0,3年及以上 大专 计算机 电子 测试 自动化 电气 车辆工程 jira 英语读写 通讯 方案 五险一金 免费班车 餐饮补贴 年终奖金 弹性工作 定期体检 股票期权 补充医疗保险
测试开发,安测半导体技术（义乌）有限公司,义乌,8000.0,2年及以上 大专 试产 debug 验证 新产品导入 j750 测试平台 93k 进度规划 试量产 ms办公软件 五险一金 带薪年假 年终奖金 绩效奖金 专业培训 定期体检 免费工作餐 租房补贴 通讯补贴 定期团建
测试工程师,深圳市豪恩科技集团股份有限公司,深圳,9000.0,4年及以上 大专 测试 功能测试 软件测试 性能测试 单元测试 驾照 测试方案 can 毫米波雷达 五险一金 年终奖金 专业培训 节日福利 方案 定期团建 绩效奖金 健身房 三餐免费
测试开发,上海同星智能科技有限公司,上海,10000.0,3年及以上 本科 计算机 测试 汽车 电子信息 tcp 电气自动化 can ip canoe 测试用例设计 五险一金 员工旅游 年终奖金 定期体检 带薪年假 有餐补
硬件测试工程师,东莞市拓嘉新能源科技有限公司,东莞,10000.0,2年及以上 本科 测试 测试用例 模拟电路 数字电路 电源 电路 英文 测试方案 光伏 ups 方案 五险一金 带薪年假 绩效奖金 项目奖金 专业培训 包吃 包住 出差补贴
硬件测试工程师,广电运通集团股份有限公司,广州,面议,在校生/应届生 本科 测试 测试用例 归档 性能测试 回归测试 可靠性测试 产品测试 检测报告 测试数据 测试规范 五险一金 补充医疗保险 带薪年假 年终奖金 定期体检 免费工作餐 免费班车
测试工程师,乔锋智能装备股份有限公司,东莞,15000.0,5年及以上 大专 测试 模具 ug 机床 测试方案 三菱 mastercam 数控系统 发那科 机床加工 方案 五险一金 带薪年假 年终奖金 项目奖金 专业培训 包吃 包住 通讯补贴 出差补贴
通信测试工程师,中软国际科技服务有限公司,成都,7000.0,1年及以上 本科 计算机 电子 通信 软件测试 软件 测试环境搭建 测试分析 测试方案设计 对接联调 通信测试 五险一金 定期体检 带薪年假 弹性工作 节日福利 周末双休
测试经理,杭州芯云半导体集团有限公司,杭州,25000.0,8年及以上 本科 培训 团队管理 npi 理工科 风险管理 开发计划 晶圆测试 上传下达 可行方案 评估测试方案 培训 方案 五险一金 餐饮补贴 绩效奖金 年终奖金 专业培训 定期体检
功能测试,万宝至（上海）管理有限公司东莞分公司,广州,3000.0,无需经验 中技/中专 办公软件 excel word ppt 理工科 马达 信赖性试验 试验室试验 五险一金 补充医疗保险 带薪年假 年终奖金 专业培训 出国机会 出差补贴 定期团建
测试工程师,湖北亿立能科技股份有限公司,武汉,6000.0,1-3年 本科 linux 测试用例 功能测试 git jmeter 接口测试 示波器 postman 性能测试 五险一金 员工旅游 专业培训 交通补贴 餐饮补贴 绩效奖金 定期体检 补充医疗保险
游戏测试,深圳奋达国际技术服务有限公司,深圳,6000.0,无需经验 大专 计算机 办公软件 excel word ppt 晋升 游戏测试 晋升管理 it互联网 前期测试 五险一金 员工旅游 专业培训 绩效奖金 弹性工作 定期体检 节假日福利
测试工程师,华传智感（上海）技术有限公司,上海,7000.0,2年 大专 电子 测试 sop 示波器 数字电路 万用表 电源 电子信息 测试方案 可靠性测试 五险一金 交通补贴 餐饮补贴 年终奖金 绩效奖金 专业培训 通讯补贴
测试工程师,华测检测认证集团股份有限公司,深圳,6000.0,1年及以上 大专 产品测试 测试设备 电子信息工程 点检 认证 期间核查 测试方法 emc测试 电磁兼容 测试原理 五险一金 通讯补贴 餐饮补贴 交通补贴 绩效奖金 专业培训 定期体检 年终奖金
软件测试,上海钱育信息科技有限公司,上海,8000.0,2年 本科 测试 软件测试 运营 系统测试 技术支持 证券 金融 五险一金 员工旅游 交通补贴 餐饮补贴 专业培训 出国机会 绩效奖金 年终奖金 弹性工作 定期体检
测试工程师,迈思普电子股份有限公司,东莞,12000.0,3年及以上 大专 资料收集 教育培训 msa 测试设备 测试流程 测试仪器 测试验证 测试数据 测试系统 grr 五险一金 员工旅游 专业培训 定期体检 法定节假日 带薪年假 试用期全薪 培训 节假日福利 生日礼品 带薪病假 绩效奖金 出国机会 出差补贴 项目奖金
软件测试,大连斯锐信息技术有限公司,郑州,9000.0,3年及以上 大专 计算机 测试用例 jmeter 软件测试 postman 测试工具 兼容性测试 脚本编写 测试效率 测试计划 五险一金 年终奖金 定期体检 专业培训 弹性工作 周末双休 股票期权 做五休二
测试工程师,湖北恒隆汽车系统集团有限公司,荆州,4000.0,1年及以上 大专 测试 实验室 机械 电气 五险一金 年终奖金 定期体检 专业培训 绩效奖金 餐饮补贴 员工旅游 带薪年假 交通补贴 节日福利 免费班车 周末双休
测试工程师,上海腾复医疗科技有限公司,上海,15000.0,3年及以上 本科 计算机 办公软件 电子 医疗器械 自动化 示波器 万用表 电源 可靠性测试 失效分析 五险一金 带薪年假 带薪病假 年终奖金 零食下午茶 定期团建
测试工程师,深圳市海曼科技股份有限公司,深圳,10000.0,3年及以上 大专 异常处理 示波器 电路设计 产品测试 pads 上位机开发 上位机编程 上位机维护 五险一金 年终奖 大小周 带薪年假 食堂 免费宿舍 宿舍 社会保险 方案 公积金 产假 节日礼物 节假日 年度旅游 丰厚奖金
测试工程师,隆鑫通用动力股份有限公司,珠海,6000.0,无需经验 本科 c++ 功能测试 通信 软件测试 c语言 研发 回归测试 编程语言 自动化控制 电机控制 五险一金 定期体检 专业培训 绩效奖金 餐饮补贴 带薪年假 交通补贴 节日福利 培训
功能测试,上海酷聚科技有限公司,上海,10000.0,1-3年 本科 方案设计 性能测试 物理 光学 仿真 传感器 光电 量产测试 测试方法 年终奖金 补充医疗保险 补充公积金 免费班车 定期体检 五险一金 专业培训
软件测试,深圳市领世达科技有限公司,深圳,5500.0,2年及以上 本科 计算机 测试用例 功能测试 软件测试 测试方案 开发测试 汽车诊断 汽车电子行业 射频测试 代码阅读 员工旅游 年终奖金 五险一金 绩效奖金 加班补贴 周末双休 节日福利 带薪年假
测试工程师,武汉东湖高新集团股份有限公司,武汉,9000.0,5年及以上 本科 计算机 java 测试 功能测试 jmeter 运维 性能测试 shell 自动化测试 http 五险一金 补充医疗保险 交通补贴 餐饮补贴 专业培训
测试工程师,无锡威孚高科技集团股份有限公司,南京,8000.0,3年及以上 本科 机械 调试 plc apqp 组装 热处理 系统集成 液压 项目计划 伺服电机 新能源 五险一金 年终奖金 定期体检 绩效奖金 通讯补贴 节日福利 补充医疗保险 培训 方案
测试工程师,上海艾杰飞人才管理咨询有限公司,嘉兴,8000.0,2年及以上 大专 测试 英语 日语 电子信息 测试设备 电气工程 维护管理 设备保养维修 pcb测试 硬件分析 方案 五险一金 补充医疗保险 带薪年假 带薪病假 定期体检
测试工程师,浙江艾罗网络能源技术股份有限公司,杭州,15000.0,5年及以上 大专 办公软件 功能测试 emc 空调 数据报表 电性能测试 电路测试 分析测试数据 热泵行业 电应力 五险一金 餐饮补贴 年终奖金 专业培训 弹性工作 定期体检 绩效奖金 股票期权 员工旅游 方案
软件测试,武汉盛帆电子股份有限公司,武汉,9000.0,1年及以上 本科 计算机 电子 通信 软件测试 英语阅读 股权激励 软件测试报告 软件bug 软件测试方案 心理咨询 节日福利 生日福利 旅游 股权激励 五险一金 年终奖金 节假日 全员持股 购房补贴 体检 方案 法定节假 食堂 育儿假 补贴
功能测试,武汉市间间壹网络科技有限公司,武汉,12000.0,2年及以上 本科 计算机 测试用例 功能测试 软件测试 postman 性能测试 自动化测试 selenium 回归测试 功能模块 补充医疗保险 补充公积金 绩效奖金 年终奖金 五险一金
软件测试,上海荣灿信息科技有限公司,深圳,8000.0,3年及以上 本科 软件测试 示波器 c1驾照 万用表 测试工具 can 信号发生器 仪表 网络管理 测试策略 管理规范 五险一金 带薪年假 专业培训 定期体检 项目奖金 绩效奖金
软件测试,大连斯锐信息技术有限公司,大连,9000.0,3年及以上 大专 计算机 测试用例 jmeter 软件测试 postman 测试工具 兼容性测试 脚本编写 测试效率 测试计划 五险一金 年终奖金 定期体检 专业培训 弹性工作 周末双休 股票期权 做五休二
测试工程师,深圳欧陆通电子股份有限公司,深圳,25000.0,5年及以上 本科 plc 自动化测试 英语读写 烙铁 labview 测试系统 电源行业 机械电子 测试项目 tr_518 五险一金 绩效奖金 节日福利 带薪年假 餐饮补贴
测试经理,深圳吉阳智能科技有限公司,佛山,20000.0,5年及以上 本科 测试 团队管理 自动化设备 测试方案 产品测试 测试工具 测试平台 非标设备 锂电设备 团队建设 五险一金 带薪年假 带薪病假 员工旅游 年终奖金 专业培训 出国机会 包住
硬件测试工程师,深圳市汇川技术股份有限公司,苏州,18000.0,6年及以上 本科 labview hmi 视觉 质量改善 测试仪器仪表 自动化导入 plc 测试 技术支持 变频器 五险一金 免费班车 员工旅游 交通补贴 出国机会 绩效奖金 年终奖金 股票期权 定期体检
测试开发,深圳精智达技术股份有限公司,深圳,12000.0,在校生/应届生 本科 java linux 测试用例 sql 自动化 半导体行业 软件工程 shell AMOLED 检测设备 五险一金 餐饮补贴 专业培训 节日补贴 带薪年假
测试工程师,上海新时达电气股份有限公司,深圳,7000.0,无需经验 本科 电子 自动化 c++ 电气 软件 工业机器人 三菱 伺服电机 西门子 测试数据 五险一金 年终奖金 定期体检 餐饮补贴 带薪年假 做五休二 节日福利 周末双休 培训
测试工程师,武汉菱电汽车电控系统股份有限公司,武汉,7000.0,1-3年 本科 测试用例 原理图 技术方案 测试方案 测试工具 测试规范 规格书 测试方法 测试报告 测试计划 五险一金 餐饮补贴 专业培训 绩效奖金 年终奖金 定期体检 方案 培训 股票期权
测试工程师,苏州弗士达科学仪器有限公司,苏州,面议,2年 本科 光学 光学检测 显示器 测试工程师 应用工程师 测试 检测 技术 技术支持 五险一金 餐饮补贴 专业培训 绩效奖金 年终奖金 节日福利 生日贺礼 每年涨薪 团建活动
测试工程师,深圳市深视智能科技有限公司,深圳,6000.0,1-3年 大专 培训 计算机 电子 测试用例 自动化 软件测试 入职培训 测试环境 运动控制 测控 带薪休假 带薪病假 五险一金 年终奖 下午茶 周末双休 健康体检 培训 购买五险 生日会 法定节假 入职培训 年度体检 发展空间 节假日
测试开发,深圳市利达泰克科技有限公司,深圳,10000.0,2年及以上 本科 自动化测试 测试仪器 电气及自动化 测试 自动化控制 测试系统 工装夹具 功率分析仪 示波器 万用表 节日福利 社保 大小周 宿舍 法定假 补充医疗保险 员工旅游 专业培训 绩效奖金 年终奖金 定期体检 五险一金
硬件测试工程师,上海朋禾智能科技有限公司,上海,6000.0,1年 本科 测试用例 调试 自动化 c++ 功能测试 编程 电子元器件 焊接 示波器 性能测试 五险一金 交通补贴 专业培训 绩效奖金 年终奖金 弹性工作 定期体检 员工旅游
测试工程师,杭州海康威视数字技术股份有限公司,杭州,13000.0,3-6年 本科 测试 测试用例 自动化 可靠性测试 机械工程 测试数据 可靠性试验 可靠性 电子电气 可靠性设计 餐饮补贴 方案 五险一金 免费班车 通讯补贴 交通补贴 年终奖金 定期体检 股票期权 弹性工作 专业培训
测试工程师,立景创新科技股份有限公司,广州,12000.0,2年及以上 大专 数据分析 测试 验收 iatf16949 自动化设备 msa 测试设备 office软件 cpk 测试流程 五险一金 年终奖金 绩效奖金 带薪年假 员工旅游 免费班车 周末双休 培训 包吃包住
软件测试,蓝网科技股份有限公司,深圳,10000.0,3-5年 本科 java oracle linux 测试 测试用例 sqlserver 功能测试 软件开发 mysql数据库 windows 五险一金 周末双休 年终奖金 绩效奖金 专业培训 节日福利 带薪年假
硬件测试工程师,挪亚检测技术有限公司,北京,8000.0,1-3年 大专 gb4943.1 itav gb8898 测试记录 电子产品检测 检测 五险一金 交通补贴 餐饮补贴 通讯补贴 绩效奖金 年终奖金 专业培训 周末双休
测试工程师,湖州超群检测科技有限公司,湖州,10000.0,3年及以上 本科 电子 测试 测试用例 生物医学工程 理工 测试方案 产品测试 机械工程 电气工程 医学影像 交通补贴 绩效奖金 节日福利 专业培训 高温补贴 五险一金 住房补贴
硬件测试工程师,广州市花捌光学技术有限公司,深圳,5000.0,无需经验 大专 售后 设备调试 调试测试 处理设备异常 设备维修 硬件测试 软件测试 计算机 物联网 互联网 五险一金 员工旅游 交通补贴 餐饮补贴 专业培训 绩效奖金 年终奖金 定期体检
测试工程师,上海瑞侃电缆附件有限公司,上海,11000.0,2年及以上 大专 培训 办公软件 测试 sop 电脑 5s 产品测试 测试设备 仪器维护 文档管理 培训 管理培训 五险一金 免费班车 专业培训 员工旅游 年终奖金 弹性工作 定期体检 补充医疗保险 股票期权
硬件测试工程师,杭州腾振科技有限公司,杭州,5000.0,2年及以上 大专 测试 产品维修 机箱组装 电路板调试 检验 五险一金 年终奖金 定期体检 带薪年假 节日福利 交通补贴 通讯补贴 周末双休 免费工作餐 出差补贴 定期团建
游戏测试,上海微创软件股份有限公司,杭州,8000.0,1年及以上 本科 计算机 测试 需求分析 质量 游戏行业 游戏测试 游戏引擎 流程改进 质量保障 rpg 免费班车 朝九晚六 五险一金 双休 弹性工作 补充医疗保险 年终奖金 周末双休 方案 能力优先 专业培训 绩效奖金 定期体检 节日福利 员工旅游
软件测试,成都长城开发科技股份有限公司,成都,8000.0,1-3年 本科 培训 计算机 电子 测试 需求分析 软件 英文 产品测试 缺陷管理 黑盒测试 培训 五险一金 补充医疗保险 补充公积金 带薪年假 年终奖金 定期体检 专业培训
